cell_type,mitochondria_per_cell,mitochondrial_volume_fraction,relative_metabolic_demand,notes,source
Mature erythrocyte (human),0,0.00,low,no mitochondria, glycolysis only,alberts-mbc-2022
Lymphocyte (resting),100,0.02,low,switches to glycolysis on activation,alberts-mbc-2022
Fibroblast,500,0.05,low,baseline reference cell,alberts-mbc-2022
Hepatocyte,1500,0.20,high,extensive metabolic activity,alberts-mbc-2022
Skeletal muscle (Type I oxidative),3000,0.10,high,marathon-runner muscle fibres,bionumbers-2015
Cardiomyocyte,5000,0.35,very high,maximally aerobic; failure -> infarction,bionumbers-2015
Oocyte (mature),100000,0.40,very high (per cell),largest mitochondrial pool; maternal inheritance,alberts-mbc-2022
Sperm (mature),50,0.30 (in midpiece),moderate,localised to midpiece flagellar base,alberts-mbc-2022
Neuron (cortical pyramidal),2000,0.15,high,axon terminals densely populated with mitochondria,attwell-laughlin-2001
