regime,fluid,coefficient_low_W_m2K,coefficient_high_W_m2K,note
free_convection_air,air,2,25,still air on a building exterior or warm object
free_convection_water,water,50,1000,buoyancy-driven flow in water
forced_convection_air_low,air,10,50,gentle fan or light wind a few m/s
forced_convection_air_high,air,50,200,strong forced airflow over a surface
forced_convection_water,water,500,3000,water pumped through a pipe near 1 m/s
condensing_steam,water,5000,20000,film condensation on a vertical tube
nucleate_boiling_water,water,5000,50000,boiling water at the heated surface
